,year,times_cited,type,id,title,journal.id,journal.title,volume,issue,researcherID
10,2020,3,preprint,pub.1127651654,Single-cell RNA-sequencing of peripheral neuroblastic tumors reveals an aggressive transitional cell state at the junction of an adrenergic-mesenchymal transdifferentiation trajectory,jour.1293558,bioRxiv,,,ur.01250725106.05
11,2020,11,article,pub.1125079310,Combination therapy with the CDK7 inhibitor and the tyrosine kinase inhibitor exerts synergistic anticancer effects against MYCN‐amplified neuroblastoma,jour.1358156,International Journal of Cancer,147,7,ur.01250725106.05
12,2019,10,article,pub.1120942583,Drugging MYCN Oncogenic Signaling through the MYCN-PA2G4 Binding Interface,jour.1319913,Cancer Research,79,21,ur.01250725106.05
13,2019,6,article,pub.1119787560,Heterozygous loss of keratinocyte TRIM16 expression increases melanocytic cell lesions and lymph node metastasis,jour.1313647,Journal of Cancer Research and Clinical Oncology,145,9,ur.01250725106.05
14,2019,1,article,pub.1119775183,Increase in DNA Damage by MYCN Knockdown Through Regulating Nucleosome Organization and Chromatin State in Neuroblastoma,jour.1045144,Frontiers in Genetics,10,,ur.01250725106.05
15,2019,46,article,pub.1111776996,Inhibition of polyamine synthesis and uptake reduces tumor progression and prolongs survival in mouse models of neuroblastoma,jour.1041454,Science Translational Medicine,11,477,ur.01250725106.05
16,2018,23,article,pub.1105007482,LDHA in neuroblastoma is associated with poor outcome and its depletion decreases neuroblastoma growth independent of aerobic glycolysis,jour.1113735,Clinical Cancer Research,24,22,ur.01250725106.05
17,2018,25,article,pub.1101901351,Network modeling of microRNA-mRNA interactions in neuroblastoma tumorigenesis identifies miR-204 as a direct inhibitor of MYCN,jour.1319913,Cancer Research,78,12,ur.01250725106.05
18,2017,0,proceeding,pub.1091006597,Abstract 4886: The BRIP1 DNA helicase is a 17q dosage sensitive cooperative driver in neuroblastoma,,,,,ur.01250725106.05
19,2017,0,proceeding,pub.1091002967,Abstract 1527: BRD3 as a specific vulnerable therapeutic target in neuroblastoma,,,,,ur.01250725106.05
20,2016,21,article,pub.1011843668,MYCN and HDAC5 transcriptionally repress CD9 to trigger invasion and metastasis in neuroblastoma,jour.1043645,Oncotarget,7,41,ur.01250725106.05
21,2016,6,article,pub.1046366774,A novel compound which sensitizes BRAF wild-type melanoma cells to vemurafenib in a TRIM16-dependent manner,jour.1043645,Oncotarget,7,32,ur.01250725106.05
22,2016,19,article,pub.1026951710,Glutathione biosynthesis is upregulated at the initiation of MYCN‐driven neuroblastoma tumorigenesis,jour.1038724,Molecular Oncology,10,6,ur.01250725106.05
23,2015,80,article,pub.1013659241,Therapeutic targeting of the MYC signal by inhibition of histone chaperone FACT in neuroblastoma,jour.1041454,Science Translational Medicine,7,312,ur.01250725106.05
24,2015,53,article,pub.1013023897,WDR5 Supports an N-Myc Transcriptional Complex That Drives a Protumorigenic Gene Expression Signature in Neuroblastoma,jour.1319913,Cancer Research,75,23,ur.01250725106.05
25,2015,0,proceeding,pub.1063264971,Abstract 962: PA2G4 predicts poor prognosis in neuroblastoma patients and promotes neuroblastoma progression by enhancing MYCN protein stability,,,,,ur.01250725106.05
26,2015,33,article,pub.1047098781,MYCN-driven regulatory mechanisms controlling LIN28B in neuroblastoma,jour.1084784,Cancer Letters,366,1,ur.01250725106.05
27,2015,12,article,pub.1030141551,Thymosin‐β4 is a determinant of drug sensitivity for Fenretinide and Vorinostat combination therapy in neuroblastoma,jour.1038724,Molecular Oncology,9,7,ur.01250725106.05
28,2015,52,article,pub.1039638309,Upregulation of MAPK Negative Feedback Regulators and RET in Mutant ALK Neuroblastoma: Implications for Targeted Treatment,jour.1113735,Clinical Cancer Research,21,14,ur.01250725106.05
29,2014,30,article,pub.1041331203,TRIM16 inhibits proliferation and migration through regulation of interferon beta 1 in melanoma cells,jour.1043645,Oncotarget,5,20,ur.01250725106.05
30,2014,0,proceeding,pub.1063255927,"Abstract 3103: IGF2BP1 and MYCN cooperate in an oncogenic feedback loop, in high-risk neuroblastoma",,,,,ur.01250725106.05
31,2014,32,article,pub.1052833738,MYCN-targeting miRNAs are predominantly downregulated during MYCN-driven neuroblastoma tumor formation,jour.1043645,Oncotarget,6,7,ur.01250725106.05
32,2014,13,article,pub.1052194468,"Art27 Interacts with GATA4, FOG2 and NKX2.5 and Is a Novel Co-Repressor of Cardiac Genes",jour.1037553,PLOS ONE,9,4,ur.01250725106.05
33,2014,147,article,pub.1034262808,The prenatal origins of cancer,jour.1029716,Nature Reviews Cancer,14,4,ur.01250725106.05
34,2013,13,article,pub.1047493686,Identification of plasma Complement C3 as a potential biomarker for neuroblastoma using a quantitative proteomic approach,jour.1294830,Journal of Proteomics,96,,ur.01250725106.05
35,2013,0,article,pub.1065267332,Correction: SUMOylation Regulates the Transcriptional Repression Activity of FOG-2 and Its Association with GATA-4,jour.1037553,PLOS ONE,8,5,ur.01250725106.05
36,2013,0,proceeding,pub.1063252059,Abstract 5043: The facilitates chromatin transcription (FACT) protein complex promotes neuroblastoma tumor initiation.,,,,,ur.01250725106.05
37,2012,10,article,pub.1045469414,SUMOylation Regulates the Transcriptional Repression Activity of FOG-2 and Its Association with GATA-4,jour.1037553,PLOS ONE,7,11,ur.01250725106.05
0,2021,0,article,pub.1141696151,Differential Interference Contrast-Based Interrogation of Plasmonic Gold Nanohole Arrays for Label-Free Imaging Sensing,jour.1298581,ACS Applied Nano Materials,,,ur.0713321776.37
1,2021,0,article,pub.1136419967,Improving capture efficiency of human cancer cell derived exosomes with nanostructured metal organic framework functionalized beads,jour.1153466,Applied Materials Today,23,,ur.0713321776.37
2,2021,0,article,pub.1137531947,Activation of the eIF2α/ATF4 axis drives triple-negative breast cancer radioresistance by promoting glutathione biosynthesis,jour.1048218,Redox Biology,43,,ur.0713321776.37
3,2020,2,article,pub.1133521776,Quality Assessment and Comparison of Plasma-Derived Extracellular Vesicles Separated by Three Commercial Kits for Prostate Cancer Diagnosis.,jour.1036368,International Journal of Nanomedicine,15,,ur.0713321776.37
4,2020,17,article,pub.1127891750,Emerging technologies for profiling extracellular vesicle heterogeneity,jour.1029977,Lab on a Chip,20,14,ur.0713321776.37
5,2020,3,article,pub.1124798739,Impact of metal crystallinity-related morphologies on the sensing performance of plasmonic nanohole arrays,jour.1043052,Nanoscale,12,14,ur.0713321776.37
6,2020,50,article,pub.1124424642,Extracellular vesicles: the next generation of biomarkers for liquid biopsy-based prostate cancer diagnosis,jour.1044673,Theranostics,10,5,ur.0713321776.37
7,2019,0,proceeding,pub.1117751765,Abstract 4754: CHTOP is a novel therapeutic target for chemoresistant epithelial ovarian cancer therapy,,,,,ur.0713321776.37
8,2019,1,article,pub.1117633494,CHTOP in Chemoresistant Epithelial Ovarian Cancer: A Novel and Potential Therapeutic Target,jour.1045696,Frontiers in Oncology,9,,ur.0713321776.37
9,2019,28,article,pub.1117183342,Liquid biopsy in ovarian cancer: recent advances in circulating extracellular vesicle detection for early diagnosis and monitoring progression,jour.1044673,Theranostics,9,14,ur.0713321776.37
10,2018,10,article,pub.1110422407,Micropatterning of porous silicon Bragg reflectors with poly(ethylene glycol) to fabricate cell microarrays: Towards single cell sensing,jour.1100063,Biosensors and Bioelectronics,127,,ur.0713321776.37
11,2017,11,article,pub.1085538870,"Patterned Plasmonic Surfaces—Theory, Fabrication, and Applications in Biosensing",jour.1031137,Journal of Microelectromechanical Systems,26,4,ur.0713321776.37
12,2016,19,article,pub.1041043334,Light-Activated Electrochemistry for the Two-Dimensional Interrogation of Electroactive Regions on a Monolithic Surface with Dramatically Improved Spatial Resolution,jour.1038386,The Journal of Physical Chemistry C,120,24,ur.0713321776.37
13,2016,26,article,pub.1008345916,"Magnetic‐Nanoparticle‐Based Immunoassays‐on‐Chip: Materials Synthesis, Surface Functionalization, and Cancer Cell Screening",jour.1032876,Advanced Functional Materials,26,22,ur.0713321776.37
14,2015,54,article,pub.1000855411,"Connecting electrodes with light: one wire, many electrodes† †J. J. G conceived the project, analyzed data and prepared the manuscript. M. C. H and S. C. performed the majority of the experiments, analyzed the data and contributed to discussing and editing the manuscript. Y. Y. performed anthraquinone experiments, Y. Z. fabricated the patterned surfaces, R. T., L. Z. and V. R. G. contributed to performing the DNA experiments. ‡ ‡Electronic supplementary information (ESI) available: Synthetic methods, additional details on the optical set up, characterization of the interfaces by XPS and electrochemically plus preliminary results on the polypyrrole and DNA experiments. See DOI: 10.1039/c5sc03011k Click here for additional data file.",jour.1044370,Chemical Science,6,12,ur.0713321776.37
15,2014,14,article,pub.1005058318,"Chemical patterning on preformed porous silicon photonic crystals: towards multiplex detection of protease activity at precise positions† †Electronic supplementary information (ESI) available: SEM images, XPS result and more optical reflectivity data. See DOI: 10.1039/c4tb00281d Click here for additional data file.",jour.1047825,Journal of Materials Chemistry B,2,23,ur.0713321776.37
16,2014,0,proceeding,pub.1098552993,Modification of porous silicon rugate filters through thiol-yne photochemistry,jour.1042151,AIP Conference Proceedings,1586,1,ur.0713321776.37
17,2014,6,chapter,pub.1048470301,5 Modifying porous silicon with self-assembled monolayers for biomedical applications,,,,,ur.0713321776.37
18,2013,20,article,pub.1055143394,"Photolithographic Strategy for Patterning Preformed, Chemically Modified, Porous Silicon Photonic Crystal Using Click Chemistry",jour.1041450,ACS Applied Materials & Interfaces,5,14,ur.0713321776.37
19,2013,6,article,pub.1071423690,Creating adhesive and soluble gradients for imaging cell migration with fluorescence microscopy.,jour.1038900,Journal of Visualized Experiments,,74,ur.0713321776.37
20,2013,65,article,pub.1047785652,Functionalised porous silicon as a biosensor: emphasis on monitoring cells in vivo and in vitro,jour.1017362,Analyst,138,13,ur.0713321776.37
21,2012,10,article,pub.1015182958,A multimodal optical and electrochemical device for monitoring surface reactions: redox active surfaces in porous silicon Rugate filters,jour.1100826,Physical Chemistry Chemical Physics,14,47,ur.0713321776.37
22,2011,15,article,pub.1037681151,Swelling induced Au–S bond breakage is determined by the molecular composition of surface tethered copolymers —carboxylated poly(OEGMA- r -HEMA),jour.1297159,Chemical Communications,47,35,ur.0713321776.37
23,2011,28,article,pub.1019014488,Directly observed Au–S bond breakage due to swelling of the anchored polyelectrolyte,jour.1297159,Chemical Communications,47,4,ur.0713321776.37
24,2010,16,article,pub.1022948363,One-step fabrication of porous polymeric microcage via electrified jetting,jour.1043052,Nanoscale,2,6,ur.0713321776.37
25,2009,67,article,pub.1055224483,Electrospinning of Poly(dimethylsiloxane)/Poly(methyl methacrylate) Nanofibrous Membrane: Fabrication and Application in Protein Microarrays,jour.1021543,Biomacromolecules,10,12,ur.0713321776.37
0,2018,26,article,pub.1106910694,Bayesian approach to determining penetrance of pathogenic SDH variants,jour.1077104,Journal of Medical Genetics,55,11,ur.0650422353.85
1,2018,28,article,pub.1106125560,Glioblastoma Recurrence Correlates With Increased APE1 and Polarization Toward an Immuno-Suppressive Microenvironment,jour.1045696,Frontiers in Oncology,8,,ur.0650422353.85
2,2017,7,article,pub.1091487989,Comprehensive analyses of somatic TP53 mutation in tumors with variable mutant allele frequency,jour.1050678,Scientific Data,4,1,ur.0650422353.85
3,2017,15,article,pub.1090885702,Analysis of SDHAF3 in familial and sporadic pheochromocytoma and paraganglioma,jour.1024632,BMC Cancer,17,1,ur.0650422353.85
4,2016,142,article,pub.1047258317,Assessing mutant p53 in primary high-grade serous ovarian cancer using immunohistochemistry and massively parallel sequencing,jour.1045337,Scientific Reports,6,1,ur.0650422353.85
5,2016,95,article,pub.1004954013,"Intratumoral heterogeneity identified at the epigenetic, genetic and transcriptional level in glioblastoma",jour.1045337,Scientific Reports,6,1,ur.0650422353.85
6,2014,0,proceeding,pub.1063258618,Abstract 5597: Targeted massively parallel sequencing for the diagnosis of hereditary neuroendocrine disorders,,,,,ur.0650422353.85
7,2014,68,article,pub.1052120798,MicroRNA-484 is more highly expressed in serum of early breast cancer patients compared to healthy volunteers,jour.1024632,BMC Cancer,14,1,ur.0650422353.85
0,2020,0,article,pub.1124917624,Indications and outcomes of rapid turn around time whole exome sequencing studies,jour.1011155,Pathology,52,,ur.07562506163.15
1,2019,5,article,pub.1110706136,Reanalysis and optimisation of bioinformatic pipelines is critical for mutation detection,jour.1103045,Human Mutation,40,4,ur.07562506163.15
0,2021,0,article,pub.1141150276,Interleukin-6 blockade for prophylaxis and management of immune-related adverse events in cancer immunotherapy,jour.1294974,European Journal of Cancer,157,,ur.0733110542.08
1,2021,0,article,pub.1141041143,Adjuvant immunotherapy recommendations for stage III melanoma: physician and nurse interviews,jour.1024632,BMC Cancer,21,1,ur.0733110542.08
2,2021,0,article,pub.1141274456,1054P FDG-PET to predict long-term outcome from anti-PD1 (PD1) therapy in metastatic melanoma,jour.1100417,Annals of Oncology,32,,ur.0733110542.08
3,2021,0,article,pub.1141274443,1042P Anti-PD1 (PD1) monotherapy or in combination with ipilimumab (IPI) after BRAF/MEK inhibitors (BRAF/MEKi) in BRAF mutant metastatic melanoma (MM) patients (pts),jour.1100417,Annals of Oncology,32,,ur.0733110542.08
4,2021,0,article,pub.1139366059,Melanoma brain metastases: the outcome of whole brain radiation therapy in the era of effective systemic therapy,jour.1319161,Therapeutic Radiology and Oncology,0,0,ur.0733110542.08
5,2021,0,article,pub.1140325031,ASO Visual Abstract: Survival Outcomes of Salvage Metastasectomy after Failure of Modern-Era Systemic Therapy for Melanoma,jour.1105545,Annals of Surgical Oncology,,,ur.0733110542.08
6,2021,0,article,pub.1140324209,Early use of high-dose-glucocorticoid for the management of irAE is associated with poorer survival in patients with advanced melanoma treated with anti-PD-1 monotherapy,jour.1113735,Clinical Cancer Research,,,ur.0733110542.08
7,2021,2,article,pub.1140184720,Survival Outcomes of Salvage Metastasectomy After Failure of Modern-Era Systemic Therapy for Melanoma,jour.1105545,Annals of Surgical Oncology,28,11,ur.0733110542.08
8,2021,0,article,pub.1141454890,PO-1413 Melanoma brain metastasis: The outcome of WBRT in the era of effective systemic therapy,jour.1094728,Radiotherapy and Oncology,161,,ur.0733110542.08
9,2021,0,article,pub.1140099252,Ipilimumab versus ipilimumab plus anti-PD-1 for metastatic melanoma – Authors' reply,jour.1023279,The Lancet Oncology,22,8,ur.0733110542.08
10,2021,0,article,pub.1139349947,Pyrexia in patients treated with dabrafenib plus trametinib across clinical trials in BRAF-mutant cancers,jour.1294974,European Journal of Cancer,153,,ur.0733110542.08
11,2021,0,proceeding,pub.1139326229,Abstract LB208: Obesity is associated with lower tumor oxidative phosphorylation (OXPhos) in metastatic melanoma (MM),,,,,ur.0733110542.08
12,2021,0,proceeding,pub.1139324733,Abstract 2761: CODEX highly multiplex image mapping to CITEseq datasets reveal the spatial dynamics of the TME during the development of acquired resistant in immunotherapy treated melanoma,,,,,ur.0733110542.08
13,2021,1,article,pub.1139315666,"Standard-Dose Pembrolizumab Plus Alternate-Dose Ipilimumab in Advanced Melanoma: KEYNOTE-029 Cohort 1C, a Phase 2 Randomized Study of Two Dosing Schedules",jour.1113735,Clinical Cancer Research,27,19,ur.0733110542.08
14,2021,0,article,pub.1139095757,Analysis of clinical and molecular profiles of patients with innate resistance to ANTI-PD-1 +/- ANTI-CTLA-4 immunotherapy in metastatic melanoma,jour.1011155,Pathology,53,,ur.0733110542.08
15,2021,1,article,pub.1139212656,Re-induction ipilimumab following acquired resistance to combination ipilimumab and anti–PD-1 therapy,jour.1294974,European Journal of Cancer,153,,ur.0733110542.08
16,2021,0,article,pub.1139165620,Clinical and Molecular Heterogeneity in Patients with Innate Resistance to Anti-PD-1 +/− Anti-CTLA-4 Immunotherapy in Metastatic Melanoma Reveals Distinct Therapeutic Targets,jour.1043163,Cancers,13,13,ur.0733110542.08
17,2021,0,article,pub.1139152463,Hyperacute toxicity with combination ipilimumab and anti-PD1 immunotherapy,jour.1294974,European Journal of Cancer,153,,ur.0733110542.08
18,2021,0,article,pub.1138786540,Re-defining the role of surgery in the management of patients with oligometastatic stage IV melanoma in the era of effective systemic therapies,jour.1294974,European Journal of Cancer,153,,ur.0733110542.08
19,2021,0,article,pub.1138775497,Risk of radiation necrosis after stereotactic radiosurgery for melanoma brain metastasis by anatomical location,jour.1054450,Strahlentherapie und Onkologie,,,ur.0733110542.08
20,2021,0,article,pub.1138728161,PDCD1 Polymorphisms May Predict Response to Anti-PD-1 Blockade in Patients With Metastatic Melanoma,jour.1045166,Frontiers in Immunology,12,,ur.0733110542.08
21,2021,0,article,pub.1138584789,Neoadjuvant Immunotherapy in Melanoma – The New Frontier,jour.1113735,Clinical Cancer Research,27,15,ur.0733110542.08
22,2021,0,article,pub.1138550909,Efficacy of adjuvant radiotherapy in recurrent melanoma after adjuvant immunotherapy.,jour.1312191,Journal of Clinical Oncology,39,15_suppl,ur.0733110542.08
23,2021,0,article,pub.1138550902,Management of resected stage III/IV melanoma with adjuvant immunotherapy.,jour.1312191,Journal of Clinical Oncology,39,15_suppl,ur.0733110542.08
24,2021,1,article,pub.1138550884,IL-6 blockade for prophylaxis and management of immune-related adverse events (irAEs) with anti-PD-1 based immunotherapy.,jour.1312191,Journal of Clinical Oncology,39,15_suppl,ur.0733110542.08
25,2021,0,article,pub.1138550874,Durability of response to immune checkpoint inhibitors (ICI) in metastatic Merkel cell carcinoma (mMCC) after treatment cessation.,jour.1312191,Journal of Clinical Oncology,39,15_suppl,ur.0733110542.08
26,2021,0,article,pub.1138550864,Patterns and management of progression on first-line ipilimumab combined with anti-PD-1 (IPI+PD1) in metastatic melanoma (MM) patients.,jour.1312191,Journal of Clinical Oncology,39,15_suppl,ur.0733110542.08
27,2021,0,article,pub.1138550861,Discrepancies in response and immune-related adverse events (irAE) of anti-PD-1 monotherapy between races and primary sites in patients (pts) with advanced nonacral cutaneous melanoma (NACM).,jour.1312191,Journal of Clinical Oncology,39,15_suppl,ur.0733110542.08
28,2021,1,article,pub.1138550856,Improved pyrexia-related outcomes associated with an adapted pyrexia adverse event (AE) management algorithm in patients (pts) treated with adjuvant dabrafenib + trametinib (dab + tram): Primary results of COMBI-APlus.,jour.1312191,Journal of Clinical Oncology,39,15_suppl,ur.0733110542.08
29,2021,0,article,pub.1138550848,Two dosing regimens of nivolumab (NIVO) plus ipilimumab (IPI) for advanced (adv) melanoma: Three-year results of CheckMate 511.,jour.1312191,Journal of Clinical Oncology,39,15_suppl,ur.0733110542.08
30,2021,4,article,pub.1138550841,Five-year overall survival from the anti-PD1 brain collaboration (ABC Study): Randomized phase 2 study of nivolumab (nivo) or nivo+ipilimumab (ipi) in patients (pts) with melanoma brain metastases (mets).,jour.1312191,Journal of Clinical Oncology,39,15_suppl,ur.0733110542.08
31,2021,8,article,pub.1137939402,"Ipilimumab alone or ipilimumab plus anti-PD-1 therapy in patients with metastatic melanoma resistant to anti-PD-(L)1 monotherapy: a multicentre, retrospective, cohort study",jour.1023279,The Lancet Oncology,22,6,ur.0733110542.08
32,2021,0,article,pub.1137836256,The role of local therapy in the treatment of solitary melanoma progression on immune checkpoint inhibition: A multicentre retrospective analysis,jour.1294974,European Journal of Cancer,151,,ur.0733110542.08
33,2021,0,article,pub.1137718150,Phenotypic Differences in Thyroid Immune Related Adverse Events Following Treatment With Immune Checkpoint Inhibitors,jour.1284458,Journal of the Endocrine Society,5,Supplement_1,ur.0733110542.08
34,2021,6,article,pub.1136659350,Chronic Immune-Related Adverse Events Following Adjuvant Anti–PD-1 Therapy for High-risk Resected Melanoma,jour.1051466,JAMA Oncology,7,5,ur.0733110542.08
35,2021,2,article,pub.1137351550,Thyroid Immune-related Adverse Events Following Immune Checkpoint Inhibitor Treatment.,jour.1017738,The Journal of Clinical Endocrinology & Metabolism,106,9,ur.0733110542.08
36,2021,6,article,pub.1136780889,Delayed immune-related adverse events with anti-PD-1-based immunotherapy in melanoma,jour.1100417,Annals of Oncology,32,7,ur.0733110542.08
37,2021,3,article,pub.1136622107,Immunotherapy use outside clinical trial populations: never say never?,jour.1100417,Annals of Oncology,32,7,ur.0733110542.08
38,2021,1,article,pub.1136614947,Should I Have Adjuvant Immunotherapy? An Interview Study Among Adults with Resected Stage 3 Melanoma and Their Partners,jour.1038760,The Patient - Patient-Centered Outcomes Research,14,5,ur.0733110542.08
39,2021,5,article,pub.1136612719,Novel adjuvant options for cutaneous melanoma,jour.1100417,Annals of Oncology,32,7,ur.0733110542.08
40,2021,1,article,pub.1136497043,Recent advancements in melanoma management,jour.1054677,Internal Medicine Journal,51,3,ur.0733110542.08
41,2021,1,article,pub.1136443220,Pathological response and tumour bed histopathological features correlate with survival following neoadjuvant immunotherapy in stage III melanoma,jour.1100417,Annals of Oncology,32,6,ur.0733110542.08
42,2021,0,article,pub.1136398172,Neoadjuvant ipilimumab plus nivolumab in synchronous clinical stage III melanoma,jour.1294974,European Journal of Cancer,148,,ur.0733110542.08
43,2021,16,article,pub.1135201485,Survival and biomarker analyses from the OpACIN-neo and OpACIN neoadjuvant immunotherapy trials in stage III melanoma,jour.1113716,Nature Medicine,27,2,ur.0733110542.08
44,2021,26,article,pub.1135200513,Pathological response and survival with neoadjuvant therapy in melanoma: a pooled analysis from the International Neoadjuvant Melanoma Consortium (INMC),jour.1113716,Nature Medicine,27,2,ur.0733110542.08
45,2021,12,article,pub.1134713825,Clinical impact of COVID-19 on patients with cancer treated with immune checkpoint inhibition,jour.1049249,Journal for ImmunoTherapy of Cancer,9,1,ur.0733110542.08
46,2021,5,article,pub.1134289514,Performance of Long-Term CT and PET/CT Surveillance for Detection of Distant Recurrence in Patients with Resected Stage IIIA–D Melanoma,jour.1105545,Annals of Surgical Oncology,28,8,ur.0733110542.08
47,2021,2,article,pub.1135236262,A multicenter characterization of hepatitis associated with immune checkpoint inhibitors,jour.1045773,OncoImmunology,10,1,ur.0733110542.08
48,2020,1,article,pub.1133346469,Ongoing partial response at 6 months to olaparib for metastatic melanoma with somatic PALB2 mutation after failure of immunotherapy: a case report,jour.1100417,Annals of Oncology,32,2,ur.0733110542.08
49,2020,0,article,pub.1133113093,Knowledge and attitudes of Australian dermatologists towards sentinel lymph node biopsy for melanoma: a mixed methods study,jour.1008960,Australasian Journal of Dermatology,62,2,ur.0733110542.08
50,2020,3,article,pub.1132893620,Clinicopathological characteristics and management of colitis with anti-PD1 immunotherapy alone or in combination with ipilimumab,jour.1049249,Journal for ImmunoTherapy of Cancer,8,2,ur.0733110542.08
51,2020,3,article,pub.1132647278,Management of melanoma brain metastases: Evidence-based clinical practice guidelines by Cancer Council Australia,jour.1294974,European Journal of Cancer,142,,ur.0733110542.08
52,2020,4,article,pub.1132687984,Tumor MHC Expression Guides First-Line Immunotherapy Selection in Melanoma,jour.1043163,Cancers,12,11,ur.0733110542.08
53,2020,0,article,pub.1132458996,194 A multicenter characterization of chronic toxicities following adjuvant anti-PD-1 therapy for high risk resected melanoma,jour.1049249,Journal for ImmunoTherapy of Cancer,8,Suppl 3,ur.0733110542.08
54,2020,0,article,pub.1132362324,Cost-effectiveness analysis of PET/CT surveillance imaging to detect systemic recurrence in resected stage III melanoma: study protocol,jour.1044693,BMJ Open,10,11,ur.0733110542.08
55,2020,1,article,pub.1132304975,Detection of BRAF splicing variants in plasma-derived cell-free nucleic acids and extracellular vesicles of melanoma patients failing targeted therapy therapies.,jour.1043645,Oncotarget,11,44,ur.0733110542.08
56,2020,0,article,pub.1131972846,Applying adjuvant therapy for melanoma into clinical practice,jour.1029638,Expert Review of Anticancer Therapy,21,2,ur.0733110542.08
57,2020,2,article,pub.1131954570,Melanoma recurrence patterns and management after adjuvant targeted therapy: a multicentre analysis,jour.1017082,British Journal of Cancer,124,3,ur.0733110542.08
