,year,times_cited,type,id,title,journal.id,journal.title,volume,issue,researcherID
40,2016,85,article,pub.1035665921,Redox cycling metals: Pedaling their roles in metabolism and their use in the development of novel therapeutics,jour.1327373,Biochimica et Biophysica Acta (BBA) - Lipids and Lipid Metabolism,1863,4,ur.01106242365.13
41,2016,88,article,pub.1035719467,Roads to melanoma: Key pathways and emerging players in melanoma progression and oncogenic signaling,jour.1327373,Biochimica et Biophysica Acta (BBA) - Lipids and Lipid Metabolism,1863,4,ur.01106242365.13
42,2015,24,article,pub.1055099782,"Novel Mechanism of Cytotoxicity for the Selective Selenosemicarbazone, 2‑Acetylpyridine 4,4-Dimethyl-3-selenosemicarbazone (Ap44mSe): Lysosomal Membrane Permeabilization",jour.1062267,Journal of Medicinal Chemistry,59,1,ur.01106242365.13
43,2015,0,proceeding,pub.1063229203,"Abstract A63: Role of the metastasis suppressor, NDRG1, in regulating the EGFR and ErbB family of receptors and its effects on key oncogenic signaling pathways in pancreatic cancer",,,,,ur.01106242365.13
44,2015,46,article,pub.1058214075,"The Metastasis Suppressor, N-MYC Downstream-regulated Gene-1 (NDRG1), Down-regulates the ErbB Family of Receptors to Inhibit Downstream Oncogenic Signaling Pathways*",jour.1077138,Journal of Biological Chemistry,291,3,ur.01106242365.13
45,2015,41,article,pub.1026273541,The molecular effect of metastasis suppressors on Src signaling and tumorigenesis: new therapeutic targets,jour.1043645,Oncotarget,6,34,ur.01106242365.13
46,2015,33,article,pub.1017343032,"The metastasis suppressor, NDRG1, inhibits “stemness” of colorectal cancer via down-regulation of nuclear β-catenin and CD44",jour.1043645,Oncotarget,6,32,ur.01106242365.13
47,2015,96,article,pub.1001378043,The renaissance of polypharmacology in the development of anti-cancer therapeutics: Inhibition of the “Triad of Death” in cancer by Di-2-pyridylketone thiosemicarbazones,jour.1013191,Pharmacological Research,100,,ur.01106242365.13
48,2015,11,article,pub.1015255643,"Differential targeting of the cyclin-dependent kinase inhibitor, p21CIP1/WAF1, by chelators with anti-proliferative activity in a range of tumor cell-types",jour.1043645,Oncotarget,6,30,ur.01106242365.13
49,2015,4,article,pub.1024163686,Targeting cancer by binding iron: Dissecting cellular signaling pathways,jour.1043645,Oncotarget,6,22,ur.01106242365.13
50,2015,101,article,pub.1002522461,Targeting cancer by binding iron: Dissecting cellular signaling pathways,jour.1043645,Oncotarget,6,22,ur.01106242365.13
51,2015,52,article,pub.1006556189,"The proto-oncogene c-Src and its downstream signaling pathways are inhibited by the metastasis suppressor, NDRG1",jour.1043645,Oncotarget,6,11,ur.01106242365.13
52,2015,11,article,pub.1027427891,Making a case for albumin a highly promising drug-delivery system,jour.1041760,Future Medicinal Chemistry,7,5,ur.01106242365.13
53,2015,34,article,pub.1005505345,Novel Thiosemicarbazones Regulate the Signal Transducer and Activator of Transcription 3 (STAT3) Pathway: Inhibition of Constitutive and Interleukin 6–Induced Activation by Iron Depletion,jour.1005093,Molecular Pharmacology,87,3,ur.01106242365.13
54,2014,0,article,pub.1034718162,539 Reversing the epithelial to mesenchymal transition with N-myc downstream regulated gene-1 and novel iron chelators in pancreatic cancer,jour.1294974,European Journal of Cancer,50,,ur.01106242365.13
55,2014,23,article,pub.1029167146,Glutathione S-transferase and MRP1 form an integrated system involved in the storage and transport of dinitrosyl–dithiolato iron complexes in cells,jour.1097289,Free Radical Biology and Medicine,75,,ur.01106242365.13
56,2014,71,article,pub.1018873309,"The Metastasis Suppressor, N-myc Downstream-regulated Gene 1 (NDRG1), Inhibits Stress-induced Autophagy in Cancer Cells",jour.1077138,Journal of Biological Chemistry,289,14,ur.01106242365.13
57,2014,65,article,pub.1033182997,Expanding horizons in iron chelation and the treatment of cancer: Role of iron in the regulation of ER stress and the epithelial–mesenchymal transition,jour.1327373,Biochimica et Biophysica Acta (BBA) - Lipids and Lipid Metabolism,1845,2,ur.01106242365.13
58,2014,79,article,pub.1017322814,The metastasis suppressor NDRG1 modulates the phosphorylation and nuclear translocation of β-catenin through mechanisms involving FRAT1 and PAK4,jour.1006098,Journal of Cell Science,127,14,ur.01106242365.13
59,2013,97,article,pub.1024564490,"Molecular functions of the iron-regulated metastasis suppressor, NDRG1, and its potential as a molecular target for cancer therapy",jour.1327373,Biochimica et Biophysica Acta (BBA) - Lipids and Lipid Metabolism,1845,1,ur.01106242365.13
60,2013,0,proceeding,pub.1063228309,Abstract A232: Novel thiosemicarbazones with potent antitumor and antimetastatic activity inhibit the signal transducer and activator of transcription (STAT) pathway.,,,,,ur.01106242365.13
61,2013,47,article,pub.1011751501,The role of NDRG1 in the pathology and potential treatment of human cancers,jour.1017953,Journal of Clinical Pathology,66,11,ur.01106242365.13
62,2013,94,article,pub.1045188272,"Metastasis suppressor, NDRG1, mediates its activity through signaling pathways and molecular motors",jour.1091552,Carcinogenesis,34,9,ur.01106242365.13
63,2013,1,article,pub.1012648993,"The redox-active, anti-cancer drug Dp44mT inhibits T-cell activation and CD25 through a copper-dependent mechanism",jour.1114406,Redox Report,18,2,ur.01106242365.13
64,2013,52,article,pub.1003180166,N-myc Downstream Regulated 1 (NDRG1) Is Regulated by Eukaryotic Initiation Factor 3a (eIF3a) during Cellular Stress Caused by Iron Depletion,jour.1037553,PLOS ONE,8,2,ur.01106242365.13
65,2013,74,article,pub.1043427430,"Dp44mT targets the AKT, TGF-β and ERK pathways via the metastasis suppressor NDRG1 in normal prostate epithelial cells and prostate cancer cells",jour.1017082,British Journal of Cancer,108,2,ur.01106242365.13
66,2013,13,article,pub.1068132318,Iron Chelation: Inhibition of Key Signaling Pathways in the Induction of the Epithelial Mesenchymal Transition in Pancreatic Cancer and Other Tumors,jour.1099658,Critical Reviews™ in Oncogenesis,18,5,ur.01106242365.13
67,2012,82,article,pub.1007849352,"Targeting the Metastasis Suppressor, NDRG1, Using Novel Iron Chelators: Regulation of Stress Fiber-Mediated Tumor Cell Migration via Modulation of the ROCK1/pMLC2 Signaling Pathway",jour.1005093,Molecular Pharmacology,83,2,ur.01106242365.13
68,2012,1,article,pub.1026920078,"379 The Anti-tumor Agent, Dp44mT, Differentially Targets the AKT, TGF-beta and ERK Pathways Via the Metastasis Suppressor NDRG1 in Normal Prostate Epithelial Cells and Prostate Cancer Cells",jour.1294974,European Journal of Cancer,48,,ur.01106242365.13
69,2012,88,article,pub.1038351535,"The Iron Chelator, Deferasirox, as a Novel Strategy for Cancer Treatment: Oral Activity Against Human Lung Tumor Xenografts and Molecular Mechanism of Action",jour.1005093,Molecular Pharmacology,83,1,ur.01106242365.13
70,2012,0,article,pub.1020210685,"A new strategy for the treatment of pancreatic cancer: Novel thiosemicarbazone iron chelators that up-regulate the iron-regulated metastasis suppressor, NDRG1",jour.1097289,Free Radical Biology and Medicine,53,,ur.01106242365.13
71,2012,38,article,pub.1032827894,Siderocalin/Lcn2/NGAL/24p3 Does Not Drive Apoptosis Through Gentisic Acid Mediated Iron Withdrawal in Hematopoietic Cell Lines,jour.1037553,PLOS ONE,7,8,ur.01106242365.13
72,2012,50,article,pub.1006600278,Synthesis and characterization of quinoline-based thiosemicarbazones and correlation of cellular iron-binding efficacy to anti-tumor efficacy,jour.1101293,Bioorganic & Medicinal Chemistry Letters,22,17,ur.01106242365.13
73,2012,120,article,pub.1059231696,"The Iron-Regulated Metastasis Suppressor NDRG1 Targets NEDD4L, PTEN, and SMAD4 and Inhibits the PI3K and Ras Signaling Pathways",jour.1021165,Antioxidants & Redox Signaling,18,8,ur.01106242365.13
74,2012,0,article,pub.1128074731,Targeting the Metastasis Suppressor NDRG1: A New Strategy for the Treatment of Pancreatic Cancer,jour.1017429,The FASEB Journal,26,S1,ur.01106242365.13
75,2012,180,article,pub.1024188079,The Iron Chelators Dp44mT and DFO Inhibit TGF-β-induced Epithelial-Mesenchymal Transition via Up-Regulation of N-Myc Downstream-regulated Gene 1 (NDRG1),jour.1077138,Journal of Biological Chemistry,287,21,ur.01106242365.13
76,2012,2,article,pub.1072336815,Targeting Iron in Cancer Cells: A New Strategy to Inhibit Metastatic Progression,jour.1155043,Vitamins & Trace Elements,01,03,ur.01106242365.13
77,2012,130,article,pub.1069162522,Iron chelators for the treatment of cancer.,jour.1112790,Current Medicinal Chemistry,19,17,ur.01106242365.13
78,2011,5,article,pub.1028109200,Research Spotlight: Iron chelation: deciphering novel molecular targets for cancer therapy. The tip of the iceberg of a web of iron-regulated molecules,jour.1041760,Future Medicinal Chemistry,3,16,ur.01106242365.13
79,2011,1,proceeding,pub.1063227623,"Abstract A67: Mechanisms involved in regulating the expression of the cyclin-dependent kinase (cdk) inhibitor, p21, by intracellular iron levels.",,,,,ur.01106242365.13
80,2011,127,article,pub.1030608960,Novel Thiosemicarbazone Iron Chelators Induce Up-Regulation and Phosphorylation of the Metastasis Suppressor N-myc Down-Stream Regulated Gene 1: A New Strategy for the Treatment of Pancreatic Cancer,jour.1005093,Molecular Pharmacology,80,4,ur.01106242365.13
81,2011,72,article,pub.1006946279,"The metastasis suppressor, N-myc downstream regulated gene 1 (NDRG1), upregulates p21 via p53-independent mechanisms",jour.1091552,Carcinogenesis,32,5,ur.01106242365.13
82,2011,7,article,pub.1056298583,Chelators to the Rescue: Different Horses for Different Courses!,jour.1098325,Chemical Research in Toxicology,24,3,ur.01106242365.13
83,2011,63,article,pub.1069194055,The medicinal chemistry of novel iron chelators for the treatment of cancer.,jour.1029353,Current Topics in Medicinal Chemistry,11,5,ur.01106242365.13
84,2010,31,article,pub.1001436590,Investigating the Spectrum of Biological Activity of Ring-Substituted Salicylanilides and Carbamoylphenylcarbamates,jour.1312072,Molecules,15,11,ur.01106242365.13
85,2010,13,article,pub.1069186667,Iron Chelators: Development of Novel Compounds with High and Selective Anti-Tumour Activity.,jour.1033424,Current Drug Delivery,7,3,ur.01106242365.13
86,2010,34,article,pub.1021287130,Investigating the anti-proliferative activity of styrylazanaphthalenes and azanaphthalenediones,jour.1104990,Bioorganic & Medicinal Chemistry,18,7,ur.01106242365.13
87,2009,0,article,pub.1027244192,ChemInform Abstract: Thiosemicarbazones from the Old to New: Iron Chelators that Are More than Just Ribonucleotide Reductase Inhibitors,jour.1016355,ChemInform,40,50,ur.01106242365.13
88,2009,0,proceeding,pub.1063226997,Abstract B172: The metastasis suppressor NDRG1 up‐regulates p21 in a p53‐independent manner in cancer cells: A novel insight into its antitumor function,,,,,ur.01106242365.13
89,2009,281,article,pub.1055956503,Thiosemicarbazones from the Old to New: Iron Chelators That Are More Than Just Ribonucleotide Reductase Inhibitors,jour.1062267,Journal of Medicinal Chemistry,52,17,ur.01106242365.13
90,2008,75,article,pub.1052748255,"The TGF-β, PI3K/Akt and PTEN pathways: established and proposed biochemical integration in prostate cancer",jour.1076908,Biochemical Journal,417,2,ur.01106242365.13
91,2008,61,article,pub.1009479261,"The iron-regulated metastasis suppressor, Ndrg-1: Identification of novel molecular targets",jour.1327373,Biochimica et Biophysica Acta (BBA) - Lipids and Lipid Metabolism,1783,10,ur.01106242365.13
92,2007,178,article,pub.1072299071,Tuning cell cycle regulation with an iron key.,jour.1030543,Cell Cycle,6,16,ur.01106242365.13
93,2006,143,article,pub.1008362487,"The metastasis suppressor, Ndrg-1: a new ally in the fight against cancer",jour.1091552,Carcinogenesis,27,12,ur.01106242365.13
0,2021,0,article,pub.1140372236,A feedback loop between the androgen receptor and 6-phosphogluoconate dehydrogenase (6PGD) drives prostate cancer growth,jour.1046517,eLife,10,,ur.0764753454.22
1,2021,2,article,pub.1138844494,Exercise-induced benefits on glucose handling in a model of diet-induced obesity are reduced by concurrent nicotinamide mononucleotide,jour.1327387,AJP Endocrinology and Metabolism,321,1,ur.0764753454.22
2,2021,7,article,pub.1136475358,Gut-derived acetate promotes B10 cells with anti-inflammatory effects,jour.1053075,JCI Insight,6,7,ur.0764753454.22
3,2021,5,article,pub.1134844498,Nicotinamide riboside supplementation does not alter whole‐body or skeletal muscle metabolic responses to a single bout of endurance exercise,jour.1312031,The Journal of Physiology,599,5,ur.0764753454.22
4,2020,0,proceeding,pub.1133247169,Abstract PO-036: ACSM1 and ACSM3 regulate fatty acid oxidation in prostate cancer to promote growth and protect against oxidative stress,,,,,ur.0764753454.22
5,2020,0,article,pub.1132841552,Dynamic 13C Flux Analysis Captures the Reorganization of Adipocyte Glucose Metabolism in Response to Insulin,jour.1319505,iScience,23,12,ur.0764753454.22
6,2020,1,preprint,pub.1131571798,Nicotinamide mononucleotide (NMN) deamidation and indirect regulation of the NAD metabolome,jour.1380788,Research Square,,,ur.0764753454.22
7,2020,4,preprint,pub.1130797996,Nicotinamide mononucleotide (NMN) deamidation by the gut microbiome and evidence for indirect upregulation of the NAD+ metabolome,jour.1293558,bioRxiv,,,ur.0764753454.22
8,2020,0,preprint,pub.1130578076,A feedback loop between the androgen receptor and 6-phosphogluoconate dehydrogenase (6PGD) drives prostate cancer growth,jour.1293558,bioRxiv,,,ur.0764753454.22
9,2020,5,article,pub.1130209538,Kinetic Trans-omic Analysis Reveals Key Regulatory Mechanisms for Insulin-Regulated Glucose Metabolism in Adipocytes,jour.1319505,iScience,23,9,ur.0764753454.22
10,2020,6,article,pub.1129711480,Insulin signaling requires glucose to promote lipid anabolism in adipocytes,jour.1077138,Journal of Biological Chemistry,295,38,ur.0764753454.22
11,2020,0,preprint,pub.1128714054,EXERCISE-INDUCED BENEFITS ON GLUCOSE HANDLING IN A MODEL OF DIET-INDUCED OBESITY ARE REDUCED BY CONCURRENT NICOTINAMIDE MONONUCLEOTIDE,jour.1293558,bioRxiv,,,ur.0764753454.22
12,2020,0,proceeding,pub.1125927582,Abstract P3-02-09: Vulnerabilities in glutamine metabolism define triple-negative from Luminal A breast cancer subsets,,,,,ur.0764753454.22
13,2020,6,article,pub.1124211927,Dynamic 13C Flux Analysis Captures the Reorganization of Adipocyte Glucose Metabolism in Response to Insulin,jour.1319505,iScience,23,2,ur.0764753454.22
14,2019,19,article,pub.1122329697,Lactate production is a prioritized feature of adipocyte metabolism,jour.1077138,Journal of Biological Chemistry,295,1,ur.0764753454.22
15,2019,5,article,pub.1122304150,Phenotypic screen for oxygen consumption rate identifies an anti-cancer naphthoquinone that induces mitochondrial oxidative stress,jour.1048218,Redox Biology,28,,ur.0764753454.22
16,2019,0,article,pub.1121888747,Metabolites downstream of predicted loss-of-function variants inform relationship to disease,jour.1009646,Molecular Genetics and Metabolism,128,4,ur.0764753454.22
17,2019,1,article,pub.1117042737,Myocardial substrate changes in advanced ischaemic and advanced dilated human heart failure,jour.1021044,European Journal of Heart Failure,21,8,ur.0764753454.22
18,2019,14,article,pub.1117035188,Snail-Overexpression Induces Epithelial-mesenchymal Transition and Metabolic Reprogramming in Human Pancreatic Ductal Adenocarcinoma and Non-tumorigenic Ductal Cells,jour.1048290,Journal of Clinical Medicine,8,6,ur.0764753454.22
19,2019,1,chapter,pub.1111933690,Using the Human Genome-Scale Metabolic Model Recon 2 for Steady-State Flux Analysis of Cancer Cell Metabolism,,,1928,,ur.0764753454.22
20,2019,0,article,pub.1111487388,13C-メタボロームおよびリン酸化プロテオームにより明らかとなった脂肪細胞の代謝プライミング,jour.1085730,Japanese Journal of Physical Fitness and Sports Medicine,68,1,ur.0764753454.22
21,2018,0,proceeding,pub.1106210740,Abstract B20: Glutamine metabolic vulnerabilities define triple-negative from luminal A breast cancer subsets,,,,,ur.0764753454.22
22,2018,4,article,pub.1105571027,Protein hypoacylation induced by Sirt5 overexpression has minimal metabolic effect in mice,jour.1312044,Biochemical and Biophysical Research Communications,503,3,ur.0764753454.22
23,2018,23,article,pub.1105110831,Benzylserine inhibits breast cancer cell growth by disrupting intracellular amino acid homeostasis and triggering amino acid response pathways,jour.1024632,BMC Cancer,18,1,ur.0764753454.22
24,2018,26,article,pub.1103671725,Improving culture performance and antibody production in CHO cell culture processes by reducing the Warburg effect,jour.1081617,Biotechnology and Bioengineering,115,9,ur.0764753454.22
25,2018,4,article,pub.1103172041,From reconstruction to C4 metabolic engineering: A case study for overproduction of polyhydroxybutyrate in bioenergy grasses,jour.1023032,Plant Science,273,,ur.0764753454.22
26,2018,4,article,pub.1101340742,Fructose bisphosphatase 2 overexpression increases glucose uptake in skeletal muscle,jour.1017739,Journal of Endocrinology,237,2,ur.0764753454.22
27,2018,17,article,pub.1100866073,Acute activation of pyruvate dehydrogenase increases glucose oxidation in muscle without changing glucose uptake,jour.1327387,AJP Endocrinology and Metabolism,315,2,ur.0764753454.22
28,2017,31,article,pub.1099720570,Dynamic Metabolomics Reveals that Insulin Primes the Adipocyte for Glucose Metabolism,jour.1046010,Cell Reports,21,12,ur.0764753454.22
29,2016,146,article,pub.1037478679,A Consensus Genome-scale Reconstruction of Chinese Hamster Ovary Cell Metabolism,jour.1051716,Cell Systems,3,5,ur.0764753454.22
30,2016,51,article,pub.1019869192,Epithelial-mesenchymal transition induction is associated with augmented glucose uptake and lactate production in pancreatic ductal adenocarcinoma,jour.1048354,Cancer & Metabolism,4,1,ur.0764753454.22
31,2016,10,article,pub.1012857396,Fast exchange fluxes around the pyruvate node: a leaky cell model to explain the gain and loss of unlabelled and labelled metabolites in a tracer experiment,jour.1048354,Cancer & Metabolism,4,1,ur.0764753454.22
32,2016,207,article,pub.1010070510,Recon 2.2: from reconstruction to model of human metabolism,jour.1036887,Metabolomics,12,7,ur.0764753454.22
33,2016,40,article,pub.1000847154,"Loss of ceramide synthase 2 activity, necessary for myelin biosynthesis, precedes tau pathology in the cortical pathogenesis of Alzheimer's disease",jour.1091979,Neurobiology of Aging,43,,ur.0764753454.22
34,2016,78,article,pub.1046869204,Low carbon fuels and commodity chemicals from waste gases – systematic approach to understand energy metabolism in a model acetogen,jour.1038683,Green Chemistry,18,10,ur.0764753454.22
35,2015,30,article,pub.1030498853,Dynamic metabolic flux analysis using B-splines to study the effects of temperature shift on CHO cell metabolism,jour.1050762,Metabolic Engineering Communications,2,,ur.0764753454.22
36,2015,73,article,pub.1000950048,A multi-tissue genome-scale metabolic modeling framework for the analysis of whole plant systems,jour.1045668,Frontiers in Plant Science,6,,ur.0764753454.22
37,2014,35,article,pub.1046110452,Metabolic Profiling and Flux Analysis of MEL-2 Human Embryonic Stem Cells during Exponential Growth at Physiological and Atmospheric Oxygen Concentrations,jour.1037553,PLOS ONE,9,11,ur.0764753454.22
38,2014,19,article,pub.1050754798,"Escherichia coli W shows fast, highly oxidative sucrose metabolism and low acetate formation",jour.1083533,Applied Microbiology and Biotechnology,98,21,ur.0764753454.22
39,2014,12,article,pub.1026491347,A depth-first search algorithm to compute elementary flux modes by linear programming,jour.1327442,BMC Systems Biology,8,1,ur.0764753454.22
40,2014,1,chapter,pub.1031082139,Customization of 13C-MFA Strategy According to Cell Culture System,,,1191,,ur.0764753454.22
41,2014,8,chapter,pub.1007645945,Steady-State 13C Fluxomics Using OpenFLUX,,,1191,,ur.0764753454.22
42,2014,23,article,pub.1000346290,Network Thermodynamic Curation of Human and Yeast Genome-Scale Metabolic Models,jour.1017078,Biophysical Journal,107,2,ur.0764753454.22
43,2014,39,article,pub.1030872934,Reducing Recon 2 for steady-state flux analysis of HEK cell culture,jour.1294801,Journal of Biotechnology,184,,ur.0764753454.22
44,2013,7,chapter,pub.1001663430,Plant Genome-Scale Modeling and Implementation,,,1090,,ur.0764753454.22
45,2012,89,article,pub.1019359666,Flux balance analysis of CHO cells before and after a metabolic switch from lactate production to consumption,jour.1081617,Biotechnology and Bioengineering,110,2,ur.0764753454.22
46,2012,69,article,pub.1009066884,A Multi-Omics Analysis of Recombinant Protein Production in Hek293 Cells,jour.1037553,PLOS ONE,7,8,ur.0764753454.22
47,2012,32,article,pub.1021557296,Reconstruction of the Saccharopolyspora erythraea genome-scale model and its use for enhancing erythromycin production,jour.1017348,Antonie van Leeuwenhoek,102,3,ur.0764753454.22
48,2012,88,article,pub.1017814006,Metabolite profiling of CHO cells with different growth characteristics,jour.1081617,Biotechnology and Bioengineering,109,6,ur.0764753454.22
49,2011,108,article,pub.1053283563,AlgaGEM – a genome-scale metabolic reconstruction of algae based on the Chlamydomonas reinhardtii genome,jour.1023790,BMC Genomics,12,Suppl 4,ur.0764753454.22
50,2011,0,article,pub.1114405991,ON THE RECONSTRUCTION OF THE MUS MUSCULUS GENOMESCALE METABOLIC NETWORK MODEL,jour.1037312,Genome Informatics,21,,ur.0764753454.22
51,2010,158,article,pub.1011599468,"C4GEM, a Genome-Scale Metabolic Model to Study C4 Plant Metabolism",jour.1018314,Plant Physiology,154,4,ur.0764753454.22
52,2009,265,article,pub.1047926686,"AraGEM, a Genome-Scale Reconstruction of the Primary Metabolic Network in Arabidopsis",jour.1018314,Plant Physiology,152,2,ur.0764753454.22
53,2009,157,article,pub.1048697485,Metabolic flux analysis in mammalian cell culture,jour.1119251,Metabolic Engineering,12,2,ur.0764753454.22
54,2009,0,chapter,pub.1038268685,Metabolic Engineering of Mammalian Cells,,,,,ur.0764753454.22
55,2009,201,article,pub.1044501760,OpenFLUX: efficient modelling software for 13C-based metabolic flux analysis,jour.1030599,Microbial Cell Factories,8,1,ur.0764753454.22
56,2008,55,proceeding,pub.1041903679,ON THE RECONSTRUCTION OF THE MUS MUSCULUS GENOME-SCALE METABOLIC NETWORK MODEL,jour.1037312,Genome Informatics,21,,ur.0764753454.22
0,2021,0,article,pub.1140399584,New Insights Into Osteoclast Biology,jour.1293029,JBMR Plus,5,9,ur.0610762237.02
1,2021,0,article,pub.1139701655,Visualisation of tumour cells in bone in vivo at single-cell resolution,jour.1095411,Bone,,,ur.0610762237.02
2,2021,0,article,pub.1137306219,The Relationship Between Sleep and Bone: Strange Bedfellows?,jour.1319259,Current Opinion in Endocrine and Metabolic Research,18,,ur.0610762237.02
3,2021,5,article,pub.1137740884,Osteocyte transcriptome mapping identifies a molecular landscape controlling skeletal homeostasis and susceptibility to skeletal disease,jour.1043282,Nature Communications,12,1,ur.0610762237.02
4,2021,0,article,pub.1137655905,Sequential dosing with zoledronate following OPG:Fc treatment protects against rebound bone loss,jour.1050942,Bone Reports,14,,ur.0610762237.02
5,2021,18,article,pub.1135713599,Osteoclasts recycle via osteomorphs during RANKL-stimulated bone resorption,jour.1019114,Cell,184,5,ur.0610762237.02
6,2020,12,article,pub.1132798211,Myeloma-Modified Adipocytes Exhibit Metabolic Dysfunction and a Senescence-Associated Secretory Phenotype,jour.1319913,Cancer Research,81,3,ur.0610762237.02
7,2020,5,article,pub.1127610180,"Elevated Bone Hardness Under Denosumab Treatment, With Persisting Lower Osteocyte Viability During Discontinuation",jour.1044865,Frontiers in Endocrinology,11,,ur.0610762237.02
8,2020,0,chapter,pub.1125771830,Myeloma Bone Disease,,,,,ur.0610762237.02
9,2019,2,article,pub.1121450912,Pretreatment with Pamidronate Decreases Bone Formation but Increases Callus Bone Volume in a Rat Closed Fracture Model,jour.1089641,Calcified Tissue International,106,2,ur.0610762237.02
10,2019,1,article,pub.1121885007,A New ‘Vicious Cycle’: Bidirectional Interactions Between Myeloma Cells and Adipocytes,jour.1297451,Clinical Lymphoma Myeloma & Leukemia,19,10,ur.0610762237.02
11,2019,11,article,pub.1121203763,Cancer Cell Dormancy in Metastasis,jour.1045812,Cold Spring Harbor Perspectives in Medicine,10,4,ur.0610762237.02
12,2019,1,article,pub.1120988848,Increased anabolic bone response in Dkk1 KO mice following tibial compressive loading,jour.1095411,Bone,131,,ur.0610762237.02
13,2019,9,article,pub.1113523823,Loss of the Vitamin D Receptor in Human Breast Cancer Cells Promotes Epithelial to Mesenchymal Cell Transition and Skeletal Colonization,jour.1096580,Journal of Bone and Mineral Research,34,9,ur.0610762237.02
14,2019,45,article,pub.1113715191,A niche-dependent myeloid transcriptome signature defines dormant myeloma cells.,jour.1085025,Blood,134,1,ur.0610762237.02
15,2019,10,article,pub.1110343329,Tumor Cell Dormancy and Reactivation in Bone: Skeletal Biology and Therapeutic Opportunities,jour.1293029,JBMR Plus,3,3,ur.0610762237.02
16,2018,4,article,pub.1104288578,Dkk1 KO Mice Treated with Sclerostin Antibody Have Additional Increases in Bone Volume,jour.1089641,Calcified Tissue International,103,3,ur.0610762237.02
17,2018,1,article,pub.1101678397,Tumor Cell Dormancy—a Hallmark of Metastatic Growth and Disease Recurrence in Bone,jour.1051428,Current Molecular Biology Reports,4,2,ur.0610762237.02
