,year,times_cited,type,id,title,journal.id,journal.title,volume,issue,researcherID
3,2021,0,article,pub.1137735053,"Successful treatment of Epstein–Barr virus–associated primary central nervous system lymphoma due to post‐transplantation lymphoproliferative disorder, with ibrutinib and third‐party Epstein–Barr virus–specific T cells",jour.1025004,American Journal of Transplantation,21,10,ur.01277214241.63
4,2021,6,article,pub.1138187788,Development of CAR T-cell lymphoma in two of ten patients effectively treated with piggyBac modified CD19 CAR T-cells.,jour.1085025,Blood,,,ur.01277214241.63
5,2021,5,article,pub.1137930443,Investigation of product derived lymphoma following infusion of piggyBac modified CD19 chimeric antigen receptor T-cells.,jour.1085025,Blood,,,ur.01277214241.63
6,2021,11,article,pub.1133883952,Identification of SARS-CoV-2 Nucleocapsid and Spike T-Cell Epitopes for Assessing T-Cell Immunity.,jour.1008072,Journal of Virology,95,6,ur.01277214241.63
7,2021,2,article,pub.1134413947,Profiling the Blood Compartment of Hematopoietic Stem Cell Transplant Patients During Human Cytomegalovirus Reactivation,jour.1046960,Frontiers in Cellular and Infection Microbiology,10,,ur.01277214241.63
8,2021,3,article,pub.1136402330,Prophylactic antigen‐specific T‐cells targeting seven viral and fungal pathogens after allogeneic haemopoietic stem cell transplant,jour.1320607,Clinical & Translational Immunology,10,3,ur.01277214241.63
9,2020,2,article,pub.1132894318,"Successful treatment of CMV, EBV, and adenovirus tissue infection following HLA‐mismatched allogeneic stem cell transplant using infusion of third‐party T cells from multiple donors in addition to antivirals, rituximab, and surgery",jour.1020818,Transplant Infectious Disease,23,2,ur.01277214241.63
10,2020,11,article,pub.1132687818,EBV-associated primary CNS lymphoma occurring after immunosuppression is a distinct immunobiological entity,jour.1085025,Blood,137,11,ur.01277214241.63
11,2020,0,article,pub.1132343369,Donor-Derived T-Cells Specific for WT1 and PRAME in Combination with T-Cells Specific for Multiple Pathogens for Prevention of Relapse and Infection after Haemopoietic Stem Cell Transplant (HSCT) for Acute Myeloid Leukaemia (AML) or High-Risk Myelodysplasia (MDS) - (The INTACT Trial),jour.1085025,Blood,136,Supplement 1,ur.01277214241.63
12,2020,4,article,pub.1129020693,Unrelated Donor Transplant Recipients Given Thymoglobuline Have Superior GRFS When Compared to Matched Related Donor Recipients Undergoing Transplantation without ATG,jour.1114940,Biology of Blood and Marrow Transplantation,26,10,ur.01277214241.63
13,2020,4,article,pub.1128500904,Whole-Genome Approach to Assessing Human Cytomegalovirus Dynamics in Transplant Patients Undergoing Antiviral Therapy,jour.1046960,Frontiers in Cellular and Infection Microbiology,10,,ur.01277214241.63
14,2020,67,article,pub.1127539033,Managing haematology and oncology patients during the COVID‐19 pandemic: interim consensus guidance,jour.1358828,The Medical Journal of Australia,212,10,ur.01277214241.63
15,2020,1,article,pub.1127818217,Allogeneic stem cell transplant (HSCT) for acute lymphoblastic leukaemia (ALL) using CD34 selected stem cells followed by prophylactic infusions of pathogen-specific and CD19 CAR T cells,jour.1021747,Cytotherapy,22,5,ur.01277214241.63
16,2020,0,article,pub.1117783824,"Pre‐ and post‐bone marrow harvest anaemia is associated with lower CD34+ stem cell collection, high harvest volume and female gender",jour.1054677,Internal Medicine Journal,50,3,ur.01277214241.63
17,2020,19,article,pub.1124235642,Single cell analysis reveals human cytomegalovirus drives latently infected cells towards an anergic-like monocyte state,jour.1046517,eLife,9,,ur.01277214241.63
18,2020,1,article,pub.1131926641,Ex vivo enrichment of PRAME antigen‐specific T cells for adoptive immunotherapy using CD137 activation marker selection,jour.1320607,Clinical & Translational Immunology,9,10,ur.01277214241.63
19,2020,6,article,pub.1128943793,Mass cytometry reveals immune signatures associated with cytomegalovirus (CMV) control in recipients of allogeneic haemopoietic stem cell transplant and CMV‐specific T cells,jour.1320607,Clinical & Translational Immunology,9,7,ur.01277214241.63
20,2019,0,article,pub.1124884508,Administration of Third-Party Virus-Specific T-Cells (VST) at the Time of Initial Therapy for Infection after Haemopoietic Stem Cell Transplant Is Safe and Associated with Favourable Clinical Outcomes (the R3ACT-Quickly trial),jour.1085025,Blood,134,Supplement_1,ur.01277214241.63
21,2019,5,article,pub.1117299794,"Pathogen-Specific T Cells Beyond CMV, EBV and Adenovirus",jour.1036284,Current Hematologic Malignancy Reports,14,4,ur.01277214241.63
22,2019,0,article,pub.1117064346,"EBV+ CNS LYMPHOMAS HAVE A DISTINCTIVE TUMOR MICROENVIRONMENT AND GENETIC PROFILE, WHICH IS AMENABLE TO COMBINATION 3RD PARTY EBV‐SPECIFIC CTL AND IBRUTINIB THERAPY",jour.1094111,Hematological Oncology,37,,ur.01277214241.63
23,2019,50,article,pub.1116130643,Human Cytomegalovirus Latency and Reactivation in Allogeneic Hematopoietic Stem Cell Transplant Recipients,jour.1044458,Frontiers in Microbiology,10,,ur.01277214241.63
24,2019,5,article,pub.1115218024,1MATCHED SIBLING DONOR-DERIVED PIGGYBAC CAR19 T CELLS INDUCE REMISSION OF RELAPSED/REFRACTORY CD19+ MALIGNANCY FOLLOWING HAEMATOPOIETIC STEM CELL TRANSPLANT,jour.1021747,Cytotherapy,21,5,ur.01277214241.63
25,2019,14,article,pub.1110277451,Restriction of Human Cytomegalovirus Infection by Galectin-9.,jour.1008072,Journal of Virology,93,3,ur.01277214241.63
26,2018,0,article,pub.1121809249,Co-Administration of 3rdparty Partially HLA Matched Cytomegalovirus Specific T Cells with Initial Antiviral Pharmacotherapy for Post-Transplant Viral Reactivation,jour.1085025,Blood,132,Supplement 1,ur.01277214241.63
27,2018,0,article,pub.1107805649,1008PD CD13 and CD33 CAR-T cells for the treatment of myeloid malignancies,jour.1100417,Annals of Oncology,29,,ur.01277214241.63
28,2018,26,article,pub.1106388979,Establishment and Operation of a Third-Party Virus-Specific T Cell Bank within an Allogeneic Stem Cell Transplant Program,jour.1114940,Biology of Blood and Marrow Transplantation,24,12,ur.01277214241.63
29,2018,2,article,pub.1106051547,Rescue haploidentical peripheral blood stem cell transplantation for engraftment failure: a single‐centre case series,jour.1054677,Internal Medicine Journal,48,8,ur.01277214241.63
30,2018,28,article,pub.1105853977,Mass Cytometry for the Assessment of Immune Reconstitution After Hematopoietic Stem Cell Transplantation,jour.1045166,Frontiers in Immunology,9,,ur.01277214241.63
31,2018,18,article,pub.1100157708,Ultra-Sensitive Droplet Digital PCR for the Assessment of Microchimerism in Cellular Therapies,jour.1114940,Biology of Blood and Marrow Transplantation,24,5,ur.01277214241.63
32,2017,63,article,pub.1100455134,Long-term control of recurrent or refractory viral infections after allogeneic HSCT with third-party virus-specific T cells.,jour.1284467,Blood Advances,1,24,ur.01277214241.63
33,2017,11,article,pub.1091818519,Cellular therapy for multiple pathogen infections after hematopoietic stem cell transplant,jour.1021747,Cytotherapy,19,11,ur.01277214241.63
34,2017,8,article,pub.1091404684,Adjuvant Peptide Pulsed Dendritic Cell Vaccination in Addition to T Cell Adoptive Immunotherapy for Cytomegalovirus Infection in Allogeneic Hematopoietic Stem Cell Transplantation Recipients,jour.1114940,Biology of Blood and Marrow Transplantation,24,1,ur.01277214241.63
35,2017,0,article,pub.1083901338,Unique case involving chromosomes 3 and 11 in myelodysplastic syndromes (MDS) confirmed by microarray studies,jour.1011155,Pathology,49,,ur.01277214241.63
36,2016,1,article,pub.1121673787,Infusion of Unrelated-Donor Partially HLA-Matched Cells Results in Detectable Microchimerism in Patients with Acute Myeloid Leukemia: Early Post-Infusion Reactions Are Common but Self-Limiting,jour.1085025,Blood,128,22,ur.01277214241.63
37,2016,9,article,pub.1023695950,Herpes simplex virus type 1 (HSV-1) specific T-cell generation from HLA-A1- and HLA-A2-positive donors for adoptive immunotherapy,jour.1021747,Cytotherapy,19,1,ur.01277214241.63
38,2016,32,article,pub.1058415003,CMV-specific immune reconstitution following allogeneic stem cell transplantation.,jour.1043518,Virulence,7,8,ur.01277214241.63
39,2016,0,article,pub.1048205916,23 Multi-Pathogen Cytotoxic T-Lymphocytes to Enhance Immunity Post-Allogeneic Stem Cell Transplantation (HSCT),jour.1021747,Cytotherapy,18,6,ur.01277214241.63
40,2016,0,article,pub.1007237154,"Third-Party Virus-Specific T Cells (VST) Are Efficacious in the Treatment of Refractory Infection Post-HSCT, However Other Cell-Mediated Immune Deficiencies Appear to Persist",jour.1114940,Biology of Blood and Marrow Transplantation,22,3,ur.01277214241.63
41,2015,5,article,pub.1121750527,"Third-Party Donor Virus-Specific T Cells Are Efficacious in the Treatment of Refractory Viral Infection Following Allogeneic HSCT, but May Not Persist Post-Infusion",jour.1085025,Blood,126,23,ur.01277214241.63
42,2015,4,article,pub.1014485017,A fatal case of acute HHV-6 myocarditis following allogeneic haemopoietic stem cell transplantation,jour.1297389,Journal of Clinical Virology,72,,ur.01277214241.63
43,2015,36,article,pub.1013833272,"Addition of varicella zoster virus–specific T cells to cytomegalovirus, Epstein-Barr virus and adenovirus tri-specific T cells as adoptive immunotherapy in patients undergoing allogeneic hematopoietic stem cell transplantation",jour.1021747,Cytotherapy,17,10,ur.01277214241.63
44,2015,56,article,pub.1049933448,Low-cost generation of Good Manufacturing Practice–grade CD19-specific chimeric antigen receptor–expressing T cells using piggyBac gene transfer and patient-derived materials,jour.1021747,Cytotherapy,17,9,ur.01277214241.63
45,2015,34,article,pub.1008805413,Influence of Stem Cell Source on Outcomes of Allogeneic Reduced-Intensity Conditioning Therapy Transplants Using Haploidentical Related Donors,jour.1114940,Biology of Blood and Marrow Transplantation,21,9,ur.01277214241.63
46,2015,0,article,pub.1044496665,Infusion of third-party partially HLA-matched virus-specific T cells to treat refractory viral infections,jour.1021747,Cytotherapy,17,6,ur.01277214241.63
47,2015,0,article,pub.1054701501,449. Multipathogen-Specific T Cells for Immune Reconstitution – A Decade of Manufacturing Development and Clinical Use,jour.1021346,Molecular Therapy,23,,ur.01277214241.63
48,2015,0,article,pub.1050321936,Moving towards pathogen‐specific T cells post‐stem cell transplant as standard of care,jour.1038235,ISBT Science Series,10,S1,ur.01277214241.63
49,2015,41,article,pub.1029169744,Adoptive T Cell Immunotherapy for Treatment of Ganciclovir‐Resistant Cytomegalovirus Disease in a Renal Transplant Recipient,jour.1025004,American Journal of Transplantation,15,3,ur.01277214241.63
50,2015,35,article,pub.1043409972,Single-Agent High-Dose Cyclophosphamide for Graft-versus-Host Disease Prophylaxis in Human Leukocyte Antigen–Matched Reduced-Intensity Peripheral Blood Stem Cell Transplantation Results in an Unacceptably High Rate of Severe Acute Graft-versus-Host Disease,jour.1114940,Biology of Blood and Marrow Transplantation,21,5,ur.01277214241.63
51,2014,0,article,pub.1121747886,Therapeutic Infusion of Partially HLA-Matched Third-Party Virus-Specific T Cells in HSCT Patients with Refractory Viral Infection,jour.1085025,Blood,124,21,ur.01277214241.63
52,2013,0,article,pub.1121816364,Prophylactic Infusion Of Multi-Virus Specific T Cells For Management Of Viral Reactivation and Infection In Patients Post Allogeneic Hematopoietic Stem Cell Transplantation (HSCT),jour.1085025,Blood,122,21,ur.01277214241.63
53,2013,0,article,pub.1047798392,Prophylactic infusion of multi-virus specific T cells for management of viral reactivation and infection in patients post allogeneic hematopoietic stem cell transplantation (HSCT),jour.1021747,Cytotherapy,15,4,ur.01277214241.63
54,2013,0,article,pub.1046779514,G-CSF primed donor haematopoietic stem cell collections are associated with reduced viable T cell yield for donor lymphocyte infusion,jour.1021747,Cytotherapy,15,4,ur.01277214241.63
55,2013,0,article,pub.1024712303,Establishment of an australian bank of third party antiviral cytotoxic T lymphocytes (CTL),jour.1021747,Cytotherapy,15,4,ur.01277214241.63
56,2013,166,article,pub.1000530319,Donor-derived CMV-specific T cells reduce the requirement for CMV-directed pharmacotherapy after allogeneic stem cell transplantation,jour.1085025,Blood,121,18,ur.01277214241.63
57,2013,28,article,pub.1017853382,Cytomegalovirus-Specific Cytotoxic T Lymphocytes Can Be Efficiently Expanded from Granulocyte Colony-Stimulating Factor–Mobilized Hemopoietic Progenitor Cell Products Ex Vivo and Safely Transferred to Stem Cell Transplantation Recipients to Facilitate Immune Reconstitution,jour.1114940,Biology of Blood and Marrow Transplantation,19,5,ur.01277214241.63
58,2013,2,article,pub.1039732771,Reduced Intensity Transplants Using G-CSF-Mobilized Hemopoietic Cells From Haploidentical Related Donors,jour.1114940,Biology of Blood and Marrow Transplantation,19,2,ur.01277214241.63
59,2012,25,article,pub.1018164391,Robust polyfunctional T-helper 1 responses to multiple fungal antigens from a cell population generated using an environmental strain of Aspergillus fumigatus,jour.1021747,Cytotherapy,14,9,ur.01277214241.63
60,2012,19,article,pub.1011031900,Clinical-grade varicella zoster virus-specific T cells produced for adoptive immunotherapy in hemopoietic stem cell transplant recipients,jour.1021747,Cytotherapy,14,6,ur.01277214241.63
61,2011,48,article,pub.1047895042,BK Virus-Specific T Cells for Use in Cellular Therapy Show Specificity to Multiple Antigens and Polyfunctional Cytokine Responses,jour.1008793,Transplantation,92,10,ur.01277214241.63
62,2011,0,article,pub.1121745151,"In Vitro Generation of Influenza-Virus Specific T Cells for Adoptive Immunotherapy,",jour.1085025,Blood,118,21,ur.01277214241.63
63,2011,12,article,pub.1011700557,In vitro generation of influenza-specific polyfunctional CD4+ T cells suitable for adoptive immunotherapy,jour.1021747,Cytotherapy,14,2,ur.01277214241.63
64,2011,0,article,pub.1047454642,"Cytotoxic T Cells Specific for Adenovirus, BKV, CMV, EBV and VZV Produced for Clinical Use in Immune Reconstitution Post Allogeneic Stem Cell Transplantation",jour.1114940,Biology of Blood and Marrow Transplantation,17,2,ur.01277214241.63
65,2011,0,article,pub.1034398381,Cytomegalovirus (CMV) pp65 Specific T Cells Expanded From Mobilised Peripheral Blood Stem Cell (PBSC) Collections for Prophylactic Adoptive Immunotherapy,jour.1114940,Biology of Blood and Marrow Transplantation,17,2,ur.01277214241.63
66,2011,1,article,pub.1028449043,BK Virus Specific T Cells Expanded Ex Vivo for Use in Cellular Therapy Show Multiple Antigen Specificity and Polyfunctional Th1 Responses,jour.1114940,Biology of Blood and Marrow Transplantation,17,2,ur.01277214241.63
67,2011,0,article,pub.1002820512,The Generation of Clinical Grade Aspergillus Fumigatus (AF) Specific Immune Cells for Adoptive Immunotherapy,jour.1114940,Biology of Blood and Marrow Transplantation,17,2,ur.01277214241.63
68,2010,0,article,pub.1121742645,"Cytotoxic T Cells Specific for Adenovirus, BK Virus, Cytomegalovirus, Epstein Barr Virus and Varicella Zoster Virus Produced for Clinical Use In Immune Reconstitution Post Allogeneic Stem Cell Transplantation",jour.1085025,Blood,116,21,ur.01277214241.63
69,2009,0,article,pub.1121629466,BK Virus Specific Cytotoxic T Cells Expanded for Clinical Use Exhibit Multiple Cytokine Functions and Individual Variation in Antigen Specificity.,jour.1085025,Blood,114,22,ur.01277214241.63
70,2009,0,article,pub.1121629464,Epstein-Barr Virus Specific Cytotoxic T Cells for Clinical Use in Immune Reconstitution Post Haemopoietic Stem Cell Transplant.,jour.1085025,Blood,114,22,ur.01277214241.63
71,2008,0,article,pub.1121812103,CMV Specific T Cells for Adoptive Transfer Exhibit Multiple Effector Functions Associated with Protective Immunity Including the Concurrent Production of Cytokines and Cytolytic Activity,jour.1085025,Blood,112,11,ur.01277214241.63
72,2008,96,article,pub.1026789312,Prophylactic infusion of cytomegalovirus-specific cytotoxic T lymphocytes stimulated with Ad5f35pp65 gene-modified dendritic cells after allogeneic hemopoietic stem cell transplantation,jour.1085025,Blood,112,10,ur.01277214241.63
73,2008,0,article,pub.1043772009,PROPHYLACTIC INFUSION OF CMV SPECIFIC CYTOTOXIC T-LYMPHOCYTES FOLLOWING ALLOGENEIC HAEMOPOIETIC STEM CELL TRANSPLANTATION,jour.1008793,Transplantation,86,2S,ur.01277214241.63
74,2008,2,article,pub.1015848125,Protein Z is reduced in chronic kidney disease and not elevated in patients on haemodialysis,jour.1101030,Blood Coagulation & Fibrinolysis,19,1,ur.01277214241.63
0,2021,0,article,pub.1136006190,Pre-treatment and real-time image guidance for a fixed-beam radiotherapy system.,jour.1018310,Physics in Medicine and Biology,66,6,ur.013451323244.74
1,2020,2,article,pub.1131742011,First experimental investigation of simultaneously tracking two independently moving targets on an MRI‐linac using real‐time MRI and MLC tracking,jour.1020133,Medical Physics,47,12,ur.013451323244.74
2,2019,5,article,pub.1110885278,Development and commissioning of a full‐size prototype fixed‐beam radiotherapy system with horizontal patient rotation,jour.1020133,Medical Physics,46,3,ur.013451323244.74
3,2018,4,article,pub.1106274161,Technical Note: Real‐time image‐guided adaptive radiotherapy of a rigid target for a prototype fixed beam radiotherapy system,jour.1020133,Medical Physics,45,10,ur.013451323244.74
4,2016,12,article,pub.1015896135,Small field correction factors for the IBA Razor,jour.1103468,Physica Medica,32,8,ur.013451323244.74
5,2016,18,article,pub.1024247051,Small field detector correction factors: effects of the flattening filter for Elekta and Varian linear accelerators,jour.1028472,Journal of Applied Clinical Medical Physics,17,3,ur.013451323244.74
6,2014,19,article,pub.1035860100,Can small field diode correction factors be applied universally?,jour.1094728,Radiotherapy and Oncology,112,3,ur.013451323244.74
7,2013,42,article,pub.1059030010,Characterization of small-field stereotactic radiosurgery beams with modern detectors.,jour.1018310,Physics in Medicine and Biology,58,21,ur.013451323244.74
8,2013,17,article,pub.1059029995,Small field dosimetric characterization of a new 160-leaf MLC.,jour.1018310,Physics in Medicine and Biology,58,20,ur.013451323244.74
9,2013,1,article,pub.1065129493,Twisted pair of optic fibers for background removal in radiation fields.,jour.1327376,Applied Optics,52,22,ur.013451323244.74
10,2013,0,article,pub.1026636656,Scintillators for 3D and 4D dosimetry: current status and future potential for clinical translation,jour.1043366,Journal of Physics Conference Series,444,1,ur.013451323244.74
11,2013,1,article,pub.1059030156,A method to remove residual signals in fibre optic luminescence dosimeters.,jour.1018310,Physics in Medicine and Biology,58,5,ur.013451323244.74
12,2012,4,article,pub.1059029235,Reply to the comment on: ‘Plastic scintillation dosimetry: comparison of three solutions for the Cerenkov challenge’,jour.1018310,Physics in Medicine and Biology,57,11,ur.013451323244.74
13,2012,21,article,pub.1005349107,Real‐time scintillation array dosimetry for radiotherapy: The advantages of photomultiplier detectors,jour.1020133,Medical Physics,39,4,ur.013451323244.74
14,2011,51,article,pub.1059028868,Plastic scintillation dosimetry: comparison of three solutions for the Cerenkov challenge.,jour.1018310,Physics in Medicine and Biology,56,18,ur.013451323244.74
0,2020,3,article,pub.1130965669,Towards real-time 4D radiation dosimetry on an MRI-Linac.,jour.1018310,Physics in Medicine and Biology,65,22,ur.01175620171.15
1,2020,2,article,pub.1131742011,First experimental investigation of simultaneously tracking two independently moving targets on an MRI‐linac using real‐time MRI and MLC tracking,jour.1020133,Medical Physics,47,12,ur.01175620171.15
2,2020,13,article,pub.1129453455,High-sensitivity in vivo contrast for ultra-low field magnetic resonance imaging using superparamagnetic iron oxide nanoparticles,jour.1051517,Science Advances,6,29,ur.01175620171.15
3,2020,4,article,pub.1126759432,Tailored nanodiamonds for hyperpolarized C13 MRI,jour.1320488,Physical Review B,101,15,ur.01175620171.15
4,2019,0,preprint,pub.1121014221,Tailored nanodiamonds for hyperpolarized 13C MRI,jour.1371339,arXiv,,,ur.01175620171.15
5,2019,14,article,pub.1113378328,Phase-Encoded Hyperpolarized Nanodiamond for Magnetic Resonance Imaging,jour.1045337,Scientific Reports,9,1,ur.01175620171.15
6,2018,10,article,pub.1101290948,An Overhauser‐enhanced‐MRI platform for dynamic free radical imaging in vivo,jour.1099715,NMR in Biomedicine,31,5,ur.01175620171.15
7,2018,0,proceeding,pub.1101590286,Nanodiamond-enhanced MRI: towards multimodality imaging of nanodiamond (Conference Presentation),,,,,ur.01175620171.15
8,2017,0,preprint,pub.1118833646,Phase-Encoded Hyperpolarized Nanodiamond for Magnetic Resonance Imaging,jour.1371339,arXiv,,,ur.01175620171.15
9,2017,54,article,pub.1085058935,Nanodiamond-enhanced MRI via in situ hyperpolarization,jour.1043282,Nature Communications,8,1,ur.01175620171.15
10,2016,18,article,pub.1055876310,Hyperpolarized Nanodiamond Surfaces,jour.1081898,Journal of the American Chemical Society,139,1,ur.01175620171.15
11,2016,0,preprint,pub.1118755737,Nanodiamond-enhanced MRI,jour.1371339,arXiv,,,ur.01175620171.15
12,2016,0,preprint,pub.1118754176,Hyperpolarized Nanodiamond Surfaces,jour.1371339,arXiv,,,ur.01175620171.15
13,2015,98,article,pub.1037945730,Low-Cost High-Performance MRI,jour.1045337,Scientific Reports,5,1,ur.01175620171.15
14,2015,49,article,pub.1025382836,Hyperpolarized nanodiamond with long spin-relaxation times,jour.1043282,Nature Communications,6,1,ur.01175620171.15
15,2015,0,preprint,pub.1118669227,Hyperpolarized Nanodiamond with Long Spin Relaxation Times,jour.1371339,arXiv,,,ur.01175620171.15
16,2013,10,article,pub.1021289723,The effect of (NH4)2Sx passivation on the (311)A GaAs surface and its use in AlGaAs/GaAs heterostructure devices,jour.1031859,Journal of Physics Condensed Matter,25,32,ur.01175620171.15
17,2012,0,preprint,pub.1118508283,"The effect of (NH4)2Sx passivation on the (311)A GaAs surface and its
  use in AlGaAs/GaAs heterostructure devices",jour.1371339,arXiv,,,ur.01175620171.15
18,2012,0,proceeding,pub.1095122052,The Origin of Gate Hysteresis in p-type Si-doped AlGaAs/GaAs Heterostructures,,,,,ur.01175620171.15
19,2012,12,article,pub.1049165469,Origin of gate hysteresis in p-type Si-doped AlGaAs/GaAs heterostructures,jour.1320488,Physical Review B,86,16,ur.01175620171.15
20,2012,0,preprint,pub.1118494019,"The origin of gate hysteresis in p-type Si-doped AlGaAs/GaAs
  heterostructures",jour.1371339,arXiv,,,ur.01175620171.15
21,2010,0,proceeding,pub.1094512276,Can insulating the gates lead us to stable modulation-doped hole quantum devices?,,,1,,ur.01175620171.15
0,2021,0,proceeding,pub.1139324733,Abstract 2761: CODEX highly multiplex image mapping to CITEseq datasets reveal the spatial dynamics of the TME during the development of acquired resistant in immunotherapy treated melanoma,,,,,ur.01367245642.54
1,2021,0,article,pub.1139095757,Analysis of clinical and molecular profiles of patients with innate resistance to ANTI-PD-1 +/- ANTI-CTLA-4 immunotherapy in metastatic melanoma,jour.1011155,Pathology,53,,ur.01367245642.54
2,2021,0,article,pub.1139165620,Clinical and Molecular Heterogeneity in Patients with Innate Resistance to Anti-PD-1 +/− Anti-CTLA-4 Immunotherapy in Metastatic Melanoma Reveals Distinct Therapeutic Targets,jour.1043163,Cancers,13,13,ur.01367245642.54
3,2021,1,article,pub.1137895774,Cryopreservation of human cancers conserves tumour heterogeneity for single-cell multi-omics analysis,jour.1040124,Genome Medicine,13,1,ur.01367245642.54
4,2021,2,article,pub.1136655449,Distribution of microRNA profiles in pre-clinical and clinical forms of murine and human prion disease,jour.1300829,Communications Biology,4,1,ur.01367245642.54
5,2020,1,preprint,pub.1128274586,Cryopreservation of human cancers conserves tumour heterogeneity for single-cell multi-omics analysis,jour.1293558,bioRxiv,,,ur.01367245642.54
6,2019,2,article,pub.1122865091,Novel miR-29b target regulation patterns are revealed in two different cell lines,jour.1045337,Scientific Reports,9,1,ur.01367245642.54
7,2019,96,article,pub.1121972017,Macrophage-Derived CXCL9 and CXCL10 Are Required for Antitumor Immune Responses Following Immune Checkpoint Blockade,jour.1113735,Clinical Cancer Research,26,2,ur.01367245642.54
8,2019,15,article,pub.1121859207,Close proximity of immune and tumor cells underlies response to anti-PD-1 based therapies in metastatic melanoma patients,jour.1045773,OncoImmunology,9,1,ur.01367245642.54
9,2019,48,article,pub.1121474332,"Site‐specific response patterns, pseudoprogression, and acquired resistance in patients with melanoma treated with ipilimumab combined with anti–PD‐1 therapy",jour.1017574,Cancer,126,1,ur.01367245642.54
10,2019,1,proceeding,pub.1120221893,Abstract 975: Liver metastases (mets) induce systemic immunosuppression and immunotherapy resistance in metastatic melanoma,,,,,ur.01367245642.54
11,2019,0,proceeding,pub.1120219207,Abstract 3246: Dynamics of T-cell checkpoint receptor profiles during melanoma progression,,,,,ur.01367245642.54
12,2019,1,proceeding,pub.1117752817,Abstract 975: Liver metastases (mets) induce systemic immunosuppression and immunotherapy resistance in metastatic melanoma,,,,,ur.01367245642.54
